{
  "schema_version": 1,
  "repository": "ml-dev-ops",
  "path_policy": "repository-relative-posix",
  "modules": [
    {
      "id": "model-preparation",
      "description": "Downloads weights, exports models, builds TensorRT engines, and validates model metadata.",
      "module_type": "tooling",
      "root": "scripts/model_preparation",
      "entrypoints": [
        {
          "path": "scripts/model_preparation/prepare_models.py",
          "status": "implemented"
        }
      ],
      "public_interfaces": [
        {
          "path": "scripts/model_preparation/README.md",
          "status": "implemented"
        },
        {
          "path": "scripts/model_preparation/Dockerfile.exporter",
          "status": "implemented"
        },
        {
          "path": "scripts/model_preparation/requirements.lock",
          "status": "implemented"
        },
        {
          "path": "scripts/model_preparation/yolo_export_adapter.py",
          "status": "implemented"
        }
      ],
      "tests": [
        {
          "path": "tests/unit/model_preparation",
          "status": "implemented"
        }
      ],
      "docs": [
        {
          "path": "docs/model-preparation.md",
          "status": "implemented"
        }
      ],
      "generated_artifacts": [
        {
          "path": "models/model-manifest.json",
          "status": "generated",
          "generator": "scripts/model_preparation/prepare_models.py",
          "sources": [
            "models/model-spec.yaml",
            "scripts/model_preparation/requirements.lock"
          ]
        },
                {
                    "path": "docs/evidence/step-3/preparation.json",
          "status": "generated",
          "generator": "scripts/model_preparation/prepare_models.py",
                    "sources": [
                        "docs/evidence/step-3/model-manifest-v1.json"
                    ]
        }
      ],
      "owned_configuration": [
        {
          "path": "models/model-spec.yaml",
          "status": "implemented"
        },
        {
          "path": "scripts/model_preparation/requirements.lock",
          "status": "implemented"
        }
      ]
    },
    {
      "id": "model-repository",
      "description": "Owns Triton model configurations, version directories, and generated model artifacts.",
      "module_type": "artifact",
      "root": "models",
      "entrypoints": [],
      "public_interfaces": [
        {
          "path": "models/model-spec.yaml",
          "status": "implemented"
        },
        {
          "path": "models/model-manifest.json",
          "status": "generated",
          "generator": "scripts/model_preparation/prepare_models.py",
          "sources": [
            "models/model-spec.yaml",
            "scripts/model_preparation/requirements.lock"
          ]
        }
      ],
      "tests": [
        {
          "path": "scripts/validate_model_repository.py",
          "status": "implemented"
        },
        {
          "path": "tests/integration/model_repository",
          "status": "planned"
        }
      ],
      "docs": [
        {
          "path": "docs/model-versioning.md",
          "status": "implemented"
        }
      ],
      "generated_artifacts": [
        {
          "path": "models/resnet50_onnx/imagenet1k.txt",
          "status": "generated",
          "generator": "scripts/model_preparation/prepare_models.py",
          "sources": [
            "models/model-spec.yaml"
          ]
        },
        {
          "path": "models/resnet50_tensorrt/imagenet1k.txt",
          "status": "generated",
          "generator": "scripts/model_preparation/prepare_models.py",
          "sources": [
            "models/model-spec.yaml"
          ]
        },
        {
          "path": "models/yolo11n_onnx/coco80.txt",
          "status": "generated",
          "generator": "scripts/model_preparation/prepare_models.py",
          "sources": [
            "models/model-spec.yaml"
          ]
        }
      ],
      "owned_configuration": [
        {
          "path": "models/resnet50_onnx/config.pbtxt",
          "status": "generated",
          "generator": "scripts/model_preparation/prepare_models.py",
          "sources": [
            "models/model-spec.yaml"
          ]
        },
        {
          "path": "models/resnet50_tensorrt/config.pbtxt",
          "status": "generated",
          "generator": "scripts/model_preparation/prepare_models.py",
          "sources": [
            "models/model-spec.yaml"
          ]
        },
        {
          "path": "models/yolo11n_onnx/config.pbtxt",
          "status": "generated",
          "generator": "scripts/model_preparation/prepare_models.py",
          "sources": [
            "models/model-spec.yaml"
          ]
        }
      ]
    },
    {
      "id": "triton-serving",
      "description": "Exposes model health, metadata, repository control, REST inference, gRPC inference, and metrics.",
      "module_type": "service",
      "root": "deployment/triton",
      "entrypoints": [
        {
          "path": "deployment/scripts/run_triton.sh",
          "status": "implemented"
        },
                {
                    "path": "deployment/triton/verify_serving.py",
                    "status": "implemented"
        }
      ],
      "public_interfaces": [
        {
          "path": "deployment/triton/README.md",
          "status": "implemented"
        },
        {
          "path": "deployment/scripts/run_triton.sh",
          "status": "implemented"
        }
      ],
      "tests": [
        {
          "path": "deployment/triton/smoke_models.py",
          "status": "implemented"
        },
                {
                    "path": "scripts/validate_model_evidence.py",
                    "status": "implemented"
                },
                {
                    "path": "scripts/validate_serving.py",
                    "status": "implemented"
                },
                {
                    "path": "scripts/validate_serving_evidence.py",
                    "status": "implemented"
                },
                {
                    "path": "tests/unit/triton_serving",
                    "status": "implemented"
        },
        {
          "path": "tests/integration/triton",
          "status": "planned"
        }
      ],
      "docs": [
        {
          "path": "docs/model-versioning.md",
          "status": "implemented"
        }
      ],
      "generated_artifacts": [
                {
                    "path": "docs/evidence/step-4/serving-runtime.json",
                    "status": "generated",
                    "generator": "deployment/triton/verify_serving.py",
                    "sources": [
                        ".env.example",
                        "models/model-spec.yaml",
                        "models/model-manifest.json",
                        "deployment/triton/verify_serving.py"
                    ]
                },
                {
                    "path": "docs/evidence/step-4/repository-versions.txt",
                    "status": "generated",
                    "generator": "deployment/triton/verify_serving.py",
                    "sources": [
                        "models/model-manifest.json",
                        "deployment/triton/verify_serving.py"
                    ]
        }
      ],
      "owned_configuration": []
    },
    {
      "id": "deployment",
      "description": "Builds, starts, stops, and health-checks the containerized runtime.",
      "module_type": "operations",
      "root": "deployment",
      "entrypoints": [
        {
          "path": "deployment/scripts/run_environment.sh",
          "status": "implemented"
        },
        {
          "path": "deployment/scripts/stop_environment.sh",
          "status": "implemented"
        },
        {
          "path": "deployment/scripts/check_environment.sh",
          "status": "implemented"
        },
        {
          "path": "deployment/scripts/capture_runtime_evidence.py",
          "status": "implemented"
        }
      ],
      "public_interfaces": [
        {
          "path": "docker-compose.yml",
          "status": "implemented"
        },
        {
          "path": "deployment/scripts/compose_common.sh",
          "status": "implemented"
        }
      ],
      "tests": [
        {
          "path": "scripts/validate_deployment.py",
          "status": "implemented"
        },
        {
          "path": "deployment/scripts/smoke_environment.py",
          "status": "implemented"
        },
        {
          "path": "scripts/validate_runtime_evidence.py",
          "status": "implemented"
        },
        {
          "path": "tests/unit/test_deployment_validation.py",
          "status": "implemented"
        },
        {
          "path": "tests/integration/deployment",
          "status": "planned"
        }
      ],
      "docs": [
        {
          "path": "docs/deployment.md",
          "status": "implemented"
        }
      ],
      "generated_artifacts": [
        {
          "path": "docs/evidence/step-2/smoke.json",
          "status": "generated",
          "generator": "deployment/scripts/capture_runtime_evidence.py",
          "sources": [
            ".env.example",
            "docker-compose.yml",
            "deployment/scripts/smoke_environment.py"
          ]
        },
        {
          "path": "docs/evidence/step-2/compose-ps.txt",
          "status": "generated",
          "generator": "deployment/scripts/capture_runtime_evidence.py",
          "sources": [
            ".env.example",
            "docker-compose.yml",
            "deployment/scripts/smoke_environment.py"
          ]
        },
        {
          "path": "docs/evidence/step-2/environment.txt",
          "status": "generated",
          "generator": "deployment/scripts/capture_runtime_evidence.py",
          "sources": [